{
  "$schema": "https://json-schema.org/draft/2020-12/schema",
  "$id": "https://detecdiv.local/schemas/detecdiv-module-v1.schema.json",
  "title": "DetecDiv module descriptor v1",
  "description": "Static identity and discovery metadata for a DetecDiv MATLAB adapter. It does not describe backend installation, weights or scientific validation.",
  "type": "object",
  "additionalProperties": false,
  "required": ["format", "id", "name", "type", "package", "adapterVersion", "summary", "capabilities", "entrypoints", "compatibility", "provenance"],
  "properties": {
    "format": { "const": "detecdiv.module.v1" },
    "id": {
      "type": "string",
      "pattern": "^[A-Za-z][A-Za-z0-9_-]*(\\.[A-Za-z][A-Za-z0-9_-]*)+$",
      "description": "Stable, case-sensitive module identity, independent of installation path."
    },
    "name": { "type": "string", "minLength": 1 },
    "type": {
      "type": "string",
      "pattern": "^[A-Za-z][A-Za-z0-9_-]*$",
      "description": "Technical module family, for example classifier or processor."
    },
    "package": {
      "type": "string",
      "pattern": "^[A-Za-z][A-Za-z0-9_]*(\\.[A-Za-z][A-Za-z0-9_]*)*$",
      "description": "Canonical MATLAB package name, preserving its letter case."
    },
    "adapterVersion": {
      "type": ["string", "null"],
      "minLength": 1,
      "description": "Adapter release version, or null when the adapter is versioned with its containing repository. This is not a backend or weight version."
    },
    "summary": { "type": "string", "minLength": 1 },
    "capabilities": {
      "type": "array",
      "uniqueItems": true,
      "items": { "type": "string", "pattern": "^[a-z][a-z0-9-]*$" },
      "description": "Discoverable possible capabilities. Effective inputs and outputs depend on node parameters and remain governed by the execution contract."
    },
    "extensions": {
      "type": "object",
      "additionalProperties": {"type": "object"},
      "description": "Opaque module-specific metadata in named object namespaces, for example extensions.hoctModel. It does not modify execution or the common contract."
    },
    "entrypoints": {
      "type": "object",
      "additionalProperties": false,
      "required": ["execute"],
      "properties": {
        "execute": { "$ref": "#/$defs/packageFunction" },
        "parameters": { "$ref": "#/$defs/packageFunction" },
        "contract": { "$ref": "#/$defs/packageFunction" },
        "validate": { "$ref": "#/$defs/packageFunction" },
        "prepare": { "$ref": "#/$defs/packageFunction" }
      }
    },
    "compatibility": {
      "type": "object",
      "additionalProperties": false,
      "required": ["detecdiv", "pipelineContract"],
      "properties": {
        "detecdiv": {
          "type": ["string", "null"],
          "minLength": 1,
          "description": "Declared DetecDiv compatibility constraint. Null means unspecified, not tested compatible with every release."
        },
        "pipelineContract": {
          "enum": ["legacy", "detecdiv.module_contract.v1"],
          "description": "Legacy resolution or a package-owned semantic declaration; neither changes the execution interface."
        },
        "runtimeContract": {
          "enum": ["legacy", "detecdiv.module_runtime.v1"],
          "description": "Optional read-only configuration validation, runtime preparation and provenance contract."
        }
      }
    },
    "provenance": {
      "type": "object",
      "additionalProperties": false,
      "required": ["repository"],
      "properties": {
        "repository": { "type": "string", "minLength": 1 },
        "maintainer": { "type": "string", "minLength": 1 }
      }
    }
  },
  "allOf": [
    {
      "if": {"properties": {"compatibility": {"properties": {"pipelineContract": {"const": "detecdiv.module_contract.v1"}}}}},
      "then": {"properties": {"entrypoints": {"required": ["contract"]}}}
    },
    {
      "if": {"properties": {"entrypoints": {"required": ["contract"]}}},
      "then": {"properties": {"compatibility": {"properties": {"pipelineContract": {"const": "detecdiv.module_contract.v1"}}}}}
    },
    {
      "if": {"properties": {"compatibility": {"required": ["runtimeContract"], "properties": {"runtimeContract": {"const": "detecdiv.module_runtime.v1"}}}}},
      "then": {"properties": {"entrypoints": {"required": ["validate", "prepare"]}}}
    },
    {
      "if": {"properties": {"entrypoints": {"required": ["validate"]}}},
      "then": {"properties": {"compatibility": {"required": ["runtimeContract"], "properties": {"runtimeContract": {"const": "detecdiv.module_runtime.v1"}}}}}
    },
    {
      "if": {"properties": {"entrypoints": {"required": ["prepare"]}}},
      "then": {"properties": {"compatibility": {"required": ["runtimeContract"], "properties": {"runtimeContract": {"const": "detecdiv.module_runtime.v1"}}}}}
    }
  ],
  "$defs": {
    "packageFunction": {
      "type": "string",
      "pattern": "^[A-Za-z][A-Za-z0-9_]*(\\.[A-Za-z][A-Za-z0-9_]*)+$"
    }
  }
}
